,year,month,date,country and location,mag,depth,mmi_level,impact,dead,injured,country,km
1361,2021,7,26,"Indonesia, Central Sulawesi offshore, 97 km west northwest of Luwuk",6.3,11,VI,"Power outages were caused and many residents evacuated due to fear of a potential tsunami. An elderly man died of shock and another died after a motorbike accident during the earthquake. Two homes were seriously damaged while in another five, damage was moderate. Damage was also reported in one school and three worship locations.",2,-,Indonesia,97
1362,2021,7,29,"United States, Alaskaoffshore, Aleutian Islands, 105 km southeast of Perryville",8.2,35,VII,Further information: 2021 Chignik earthquake,-,-,United States,"Aleutian Islands, 105"
1363,2021,7,29,"Myanmar, Sagaing, 46 km northeast of Shwebo",5.5,10,VII,"A brick wall collapsed in Yae Oo town of the Sagaing Division. In the Chanayethazan Township of Mandalay, a monastery partially collapsed.",-,-,Myanmar,46
1364,2021,7,30,"Peru, Piura, 9 km east southeast of Sullana",6.2,34.4,VII,"Moderate damage was reported near the epicenter, where various old houses were damaged, as well as Piura Cathedral. A total of 721 residents suffered injuries. Two adults and a child had serious injuries after falling from height.",-,721,Peru,9
1365,2021,8,2,"Indonesia, West Papua offshore, 182 km northeast of Tual",6.0,10,IV,-,-,-,Indonesia,182
1366,2021,8,3,"India, Andaman and Nicobar Islandsoffshore, 339 km south southeast of Port Blair",6.1,10,IV,-,-,-,India,339
1367,2021,8,4,"China, Guangxi, 58 km southeast of Baise City",4.5,13.8,-,Over 500 houses and some roads were damaged in Debao County. Electricity was also disrupted.,-,-,China,58
1368,2021,8,11,"Indonesia, North Sumatra, 11 km southeast of Padangsidempuan",4.8,10,II,Two buildings were damaged in the North Padang Lawas Regency.,-,-,Indonesia,11
1369,2021,8,11,"Philippines, Davao offshore, 60 km east northeast of Pondaguitan",7.1,55.1,VII,Further information: 2021 Davao Oriental earthquake,1,-,Philippines,60
1370,2021,8,12,"South Georgia and the South Sandwich Islands offshore, South Sandwich Islandsregion",7.5,47.2,VI,Further information: 2021 South Sandwich Islands earthquakes,-,-,South Georgia and the South Sandwich Islands offshore,
1371,2021,8,12,,8.1,22.8,VII,,-,-,,
1372,2021,8,12,,6.7,35,-,Aftershocks of the 8.1 earthquake an hour earlier.,-,-,,
1373,2021,8,12,,6.1,35,IV,,-,-,,
1374,2021,8,12,,6.0,35,IV,,-,-,,
1375,2021,8,12,"Russia, Kemerovo Oblast, 34 km northeast of Karagayla",5.0,10,V,Some buildings were damaged in Novokuznetsk.,-,-,Russia,34
1376,2021,8,12,"Spain, Andalusia, 2 km west of Santa Fe",4.6,10,VII,"The strongest earthquake to hit the region since 1984. One house partially collapsed, and cracks in walls appeared in some others.",-,-,Spain,2
1377,2021,8,13,"South Georgia and the South Sandwich Islands offshore, South Sandwich Islandsregion",6.1,10,IV,Aftershock of the 8.1 earthquake 16 hours earlier.,-,-,South Georgia and the South Sandwich Islands offshore,
1378,2021,8,14,"United States, Alaska offshore, Aleutian Islands, 117 km southeast of Perryville",6.9,21,V,Aftershock of the 8.2 earthquake on July 29.,-,-,United States,"Aleutian Islands, 117"
1379,2021,8,14,"Haiti, Nippes",7.2,10,VIII,Further information: 2021 Haiti earthquake,"2,248","12,763",Haiti,
1380,2021,8,16,"South Georgia and the South Sandwich Islands offshore, South Sandwich Islandsregion",6.9,14,IV,Aftershocks of the 8.1 earthquake on August 12.,-,-,South Georgia and the South Sandwich Islands offshore,
1381,2021,8,17,,6.1,47.1,IV,,-,-,,
1382,2021,8,18,"Vanuatu, Sanma offshore, 17 km north of Port Olry",6.9,93,VII,-,-,-,Vanuatu,17
1383,2021,8,18,"South Georgia and the South Sandwich Islands offshore, South Sandwich Islandsregion",6.0,28,IV,Aftershocks of the 8.1 earthquake on August 12.,-,-,South Georgia and the South Sandwich Islands offshore,
1384,2021,8,22,,6.6,11,IV,,-,-,,
1385,2021,8,22,,7.1,14,IV,,-,-,,
1386,2021,8,24,"Russia, Kuril Islands offshore, 223 km southwest of Severo-Kurilsk",6.0,31,IV,-,-,-,Russia,223
1387,2021,8,24,"Honduras, Santa Bárbara, 11 km north northeast of Pinalejo",5.2,7.8,VI,"Several buildings, including a school and a hospital, were damaged in Santa Rita and San Pedro Sula.",-,-,Honduras,11
1388,2021,8,26,"Indonesia, Central Sulawesi offshore, 106 km northeast of Poso",5.7,8,VII,"A collapsing house crushed one person to death, while 39 people suffered injuries. At least 297 houses suffered damage.",1,39,Indonesia,106
1389,2021,8,31,"Tanzania, Shinyanga, 33 km northeast of Masumbwe",4.8,10,V,"Cracks were observed in walls of some houses, and one person suffered injuries.",-,1,Tanzania,33
1390,2021,8,31,"New Zealand, Kermadec Islandsoffshore, 989 km south southwest of 'Ohonua, Tonga",6.4,16,IV,Aftershock of the 8.1 quake on March 4.,-,-,New Zealand,989
1391,2021,8,31,"Turkey, Kütahya, 19 km west of ?hsaniye",5.1,10,V,Fifteen homes collapsed in Alt?nta?. Bricks were dislodged and fell from a balcony and chimneys. The earthquake destroyed a barn and caused solar panels on a roof to explode.,-,-,Turkey,19
1392,2021,9,7,"Tonga, Ha?apai offshore, 185 km west northwest of Pangai",6.0,10,IV,-,-,-,Tonga,185
1393,2021,9,8,"Mexico, Guerrero, Acapulco",7.0,20,VIII,Further information: 2021 Guerrero earthquake,13,23,Mexico,Acapulco
1394,2021,9,13,"Iran, Razavi Khorasan, 38 km east northeast of Quchan",5.1,10,V,At least 623 houses collapsed and 226 others were damaged in 42 villages around the epicenter. At least 23 people were injured during the quake.,-,23,Iran,38
1395,2021,9,13,"Argentina, Salta, 79 km northwest of San Antonio de los Cobres",6.2,193.4,IV,-,-,-,Argentina,79
1396,2021,9,13,"Indonesia, North Maluku, 153 km south of Sofifi",4.6,10,-,One house was severely damaged in Bancan.,-,-,Indonesia,153
1397,2021,9,15,"China, Sichuan, 52 km southeast of Neijiang",5.4,7.1,VII,Further information: 2021 Luxian earthquake,3,146,China,52
1398,2021,9,18,"Papua New Guinea, Oro, 117 km south southeast of Popondetta",5.3,20.3,VI,The quake caused flooding which destroyed some food gardens and a bridge.,-,-,Papua New Guinea,117
1399,2021,9,19,"Peru, Arequipa, 5 km southeast of Huambo",4.6,10,IV,Six homes were damaged in Maca District.,-,-,Peru,5
1400,2021,9,19,"Iran, Isfahan, 41 km northwest of Yasuj",4.3,10,II,Aftershock of the 2021 Sisakht earthquake. Some buildings were damaged in Yasuj.,-,-,Iran,41
1401,2021,9,20,"Russia, Kuril Islands offshore",6.1,25,IV,-,-,-,Russia,
1402,2021,9,21,"Chile, Biobío offshore, 81 km northwest of Arauco",6.4,12.5,V,-,-,-,Chile,81
1403,2021,9,21,"Australia, Victoria, 39 km south of Mount Buller",5.9,12,VII,Further information: 2021 Mansfield earthquake,-,1,Australia,39
1404,2021,9,22,"Nicaragua, Chinandega offshore, 78 km southwest of Jiquilillo",6.5,30.7,V,-,-,-,Nicaragua,78
1405,2021,9,24,"United States, Alaska offshore, Aleutian Islands, 187 km west southwest of Adak",6.1,39.6,V,-,-,-,United States,"Aleutian Islands, 187"
1406,2021,9,27,"Greece, Crete, 6 km north of Thrapsanón",6.0,6,VII,Further information: 2021 Arkalochori earthquake,1,35,Greece,6
1407,2021,9,28,"Indonesia, Central Java, 9 km north northwest of Bumiayu",3.0,10,-,"At least 23 houses in 2 districts of Brebes Regencywere damaged, 4 of them seriously. A hill suffered a 150-meter-long crack.",-,-,Indonesia,9
1408,2021,9,28,"Greece, Crete, 9 km southwest of Arkalochóri",5.3,10,V,Aftershock of the 6.0 earthquake a day earlier. Some homes collapsed.,-,-,Greece,9
1409,2021,9,29,"Argentina, Mendoza, 32 km east southeast of San Martín",4.9,30,VI,Some houses were damaged or destroyed in Rivadavia.,-,-,Argentina,32
1410,2021,9,29,"Japan, Niigata offshore, 241 km northwest of Nanao",6.1,367.7,III,-,-,-,Japan,241
1411,2021,9,29,"Philippines, Soccksargen, 20 km southeast of Lake Sebu",4.0,5,-,"Several houses, schools, and other buildings were damaged in T'Boli. At least four hot springs also appeared after the earthquake.",-,-,Philippines,20
1412,2021,10,1,"Iran, Bushehr, 24 km north of Gen?veh",4.9,10,VI,Three people were injured.,-,3,Iran,24
1413,2021,10,2,Vanuatu region offshore,7.3,535.8,IV,-,-,-,Vanuatu region offshore,
1414,2021,10,2,Mid-Indian Ridge,6.0,10,-,-,-,-,Mid-Indian Ridge,
1415,2021,10,2,"Philippines, Mimaropa, 11 km northeast of Tuban",5.4,8.7,VII,"The walls of five homes collapsed, with damage totaling ?208,000.",-,-,Philippines,11
1416,2021,10,4,"Iran, Khuzestan, 61 km northeast of Masjed Soleym?n",5.5,13,VI,"At least eight people were injured and over 3,000 buildings were damaged in Kuhrang County.",-,8,Iran,61
1417,2021,10,4,"South Georgia and the South Sandwich Islands offshore, South Sandwich Islandsregion",6.2,10,IV,Aftershock of the 8.1 earthquake on August 12.,-,-,South Georgia and the South Sandwich Islands offshore,
1418,2021,10,5,"Japan, Iwate offshore, 48 km north northeast of Miyako",5.7,55,V,Three people had minor injuries and at least one building was damaged.,-,3,Japan,48
1419,2021,10,6,"Croatia, Split-Dalmatia County, 10 km east of Otok",4.9,10,VI,"Some buildings were damaged in Split, and a landslide was reported in Trilj.",-,-,Croatia,10
1420,2021,10,6,"Pakistan, Balochistan, 11 km north northeast of Harnai",5.9,9,VII,Further information: 2021 Balochistan earthquake,42,300,Pakistan,11
1421,2021,10,6,"Argentina, Salta, 21 km northeast of El Galpón",5.0,10,IV,"Some damage in supermarkets, and two people were hospitalized.",-,2,Argentina,21
1422,2021,10,7,"Japan, Chiba, 5 km southwest of Chiba",5.9,62,VII,Further information: 2021 Chiba earthquake,-,51,Japan,5
1423,2021,10,8,"Iran, Khuzestan, 59 km northeast of Masjed Soleym?n",5.1,10,IV,Three people were injured when fleeing in panic.,-,3,Iran,59
1424,2021,10,9,"Peru, Arequipa, 4 km northwest of Madrigal",5.7,14.2,VI,"More than 140 houses were damaged, seven of them seriously.",-,-,Peru,4
1425,2021,10,9,Vanuatu region offshore,6.9,520.4,III,Aftershock of the 7.3 earthquake on October 2.,-,-,Vanuatu region offshore,
1426,2021,10,10,"Pakistan, Balochistan, 6 km south of Harnai",4.5,10,III,Aftershock of the 2021 Balochistan earthquake. Six people were injured and there was additional damage.,-,6,Pakistan,6
1427,2021,10,10,"United States, Hawaii offshore, 27 km south southwest of Naalehu",6.2,35.1,VII,"This was the strongest earthquake in the US state since the 2018 Hawaii earthquake. In Naalehu, objects fell off shelves and cracks appeared in drywalls. Rockfalls were also reported in the Halema?uma?u Crater.",-,-,United States,27
1428,2021,10,11,"United States, Alaska offshore, 112 km east of Chignik",6.9,51.6,VI,Aftershock of the 8.2 earthquake on July 29.,-,-,United States,112
1429,2021,10,11,"India, Karnataka, 7 km northeast of Shahabad",4.3,10,IV,Thirty houses collapsed and ten others were damaged in Kalaburagi.,-,-,India,7
1430,2021,10,12,"Greece, Crete, 4 km southwest of Palekastro",6.4,20,VIII,Further information: 2021 Lasithi earthquake,-,-,Greece,4
1431,2021,10,13,"Argentina, Santa Cruz, 2 km northeast of El Calafate",5.4,10,VII,Cracks in walls and roads at El Calafate city. Rockslides were also reported.,-,-,Argentina,2
1432,2021,10,14,"China, Inner Mongolia, 180 km west northwest of Tongliao",4.4,10,-,"At least 958 buildings were damaged in Ar Horqin Banner. At least 1,000 people were affected.",-,-,China,180
1433,2021,10,15,"Solomon Islands, Isabel offshore, 146 km west southwest of Buala",6.4,22.6,VI,Two houses were destroyed and 23 others were damaged in Gatokae Island. One person was injured after the canteen of a school collapsed.,-,1,Solomon Islands,146
1434,2021,10,15,"Indonesia, Bali, 18 km north northeast of Banjar Wangsian",4.7,10,VIII,Further information: 2021 Bali earthquake,4,73,Indonesia,18
1435,2021,10,16,"Iran, Kerman, 16 km south of Shahrak-e P?bed?n?",4.8,10,-,"At least 3,530 buildings were damaged. There were reports of collapsed walls and broken windows in Bob-Tangol and in Taleghani.",-,-,Iran,16
1436,2021,10,18,"Vanuatu, Torba offshore, 67 km west northwest of Sola",6.2,96.5,V,-,-,-,Vanuatu,67
1437,2021,10,21,"Tonga offshore, south of the Fiji Islands",6.1,497.2,II,-,-,-,Tonga offshore,
1438,2021,10,22,"Indonesia, East Java offshore, 53 km southwest of Dampit",4.9,72.9,IV,Several buildings were damaged in Blitar. The earthquake also destroyed a local mosque.,-,-,Indonesia,53
1439,2021,10,22,"Indonesia, Central Java, 15 km west of Salatiga",2.9,10,-,It is the largest earthquake in a swarm related to Mount Telomoyo. Several buildings were damaged.,-,-,Indonesia,15
1440,2021,10,24,"Taiwan, Yilan, 21 km south southeast of Yilan",6.2,64.5,VI,A woman in Hualien Countywas injured by falling rocks. The Taipei Metro was temporarily suspended.,-,1,Taiwan,21
1441,2021,10,29,"Albania, Dibër, 9 km northeast of Bulqizë",4.7,10,VI,At least 16 homes were damaged.,-,-,Albania,9
1442,2021,11,1,"South Georgia and the South Sandwich Islands offshore, South Sandwich Islandsregion",6.0,22,IV,Aftershock of the 8.1 earthquake on August 12.,-,-,South Georgia and the South Sandwich Islands offshore,
1443,2021,11,1,"Indonesia, North Sumatra offshore, 255 km south of Sinabang",6.0,15.3,IV,-,-,-,Indonesia,255
1444,2021,11,4,"Indonesia, Maluku, 65 km northeast of Amahai",5.7,18,VI,At least 26 homes in the Central Maluku Regencywere damaged.,-,-,Indonesia,65
1445,2021,11,4,"Pakistan, Sind, 22 km southeast of Jati",4.9,10,III,"Cracks appeared in some buildings in Lakhpat, in neighboring India.",-,-,Pakistan,22
1446,2021,11,6,"Indonesia, North Sulawesi offshore, 154 km of Gorontalo",6.0,39.9,V,-,-,-,Indonesia,154
1447,2021,11,8,"Turkey, Konya, 22 km southeast of Derbent",5.1,10,V,"Three buildings were destroyed and 151 were damaged in K?z?lören, Küçükmuhsine Sefaköy and Tepekent. Two people were injured after falling from stairs.",-,2,Turkey,22
1448,2021,11,9,"Nicaragua, Carazo offshore, 61 km south of Masachapa",6.3,35,V,-,-,-,Nicaragua,61
1449,2021,11,10,"Japan, Ryukyu Islands offshore, 184 km southeast of Hirara",6.6,10,IV,-,-,-,Japan,184
1450,2021,11,10,"Indonesia, Papua offshore, 182 km southwest of Nabire",6.0,10,V,-,-,-,Indonesia,182
1451,2021,11,14,"Iran, Hormozgan, 62 km north northwest of Bandar Abbas",6.0,9,VII,Further information: 2021 Hormozgan earthquakes,2,98,Iran,62
1452,2021,11,14,,6.4,10,IX,,,,,
1453,2021,11,15,South Indian Ocean,6.0,10,-,-,-,-,South Indian Ocean,
1454,2021,11,18,"Papua New Guinea, New Irelandoffshore, 189 km southeast of Kokopo",6.2,36.3,IV,-,-,-,Papua New Guinea,189
1455,2021,11,19,"Turkey, Erzurum, 23 km northwest of Karayaz?",5.1,6.2,VII,At least 55 houses and 35 barns collapsed in several villages near the epicentre. Two people were injured.,-,2,Turkey,23
1456,2021,11,20,"Azerbaijan, Shirvan, 12 km northeast of Shamakhi",5.0,10,VI,A house was damaged in Agsu.,-,-,Azerbaijan,12
1457,2021,11,25,"Solomon Islands, Santa Cruz Islandsoffshore, 77 km east of Lata",6.1,10,VII,-,-,-,Solomon Islands,77
1458,2021,11,26,"Myanmar, Chin, 20 km west southwest of Falam",6.2,43,VIII,"In Hakha, Myanmar, the ceiling of a church partially collapsed. In Bangladesh, one person was injured after jumping off the second floor of a building at Chittagong University, and a four-storey apartment tilted to its side and struck a neighbouring building in Chawkbazar Thana.",-,1,Myanmar,20
1459,2021,11,28,"Peru, Loreto, 43 km north northwest of Barranca",7.5,126,VIII,Further information: 2021 Northern Peru earthquake,12,136,Peru,43
1460,2021,11,29,"Japan, Izu Islands offshore, 484 km southeast of Katsuura",6.3,6.1,III,-,-,-,Japan,484
1461,2021,11,30,"Papua New Guinea, New Irelandoffshore, 112 km southeast of Kavieng",6.3,10,V,-,-,-,Papua New Guinea,112
1462,2021,11,30,"Papua New Guinea, New Irelandoffshore, 113 km northwest of Rabaul",6.1,10,IV,Aftershock of the 6.3 earthquake a minute earlier.,-,-,Papua New Guinea,113
1463,2021,12,3,"Japan, Kansai, 9 km southwest of Gob?",5.2,11.3,VI,Two homes suffered minor damage and broken windows were reported in Wakayama. Five people were injured.,-,5,Japan,9
1464,2021,12,3,"Chile, Easter Island offshore, 295 km west southwest of Hanga Roa",6.1,10,III,-,-,-,Chile,295
1465,2021,12,3,"South Georgia and the South Sandwich Islands offshore, South Sandwich Islands region",6.0,9.9,III,Aftershock of the 8.1 earthquake on August 12.,-,-,South Georgia and the South Sandwich Islands offshore,
1466,2021,12,4,"Indonesia offshore, Philippine Sea, 259 km north of Tobelo",6.0,174.3,IV,-,-,-,Indonesia offshore,259
1467,2021,12,5,"Peru, Lambayeque, 14 km west northwest of Mochumi",4.1,60,-,One house collapsed and nine others were damaged in the Incahuasi District. Two people were left homeless.,-,-,Peru,14
1468,2021,12,5,"Turkey, Van, 18 km southeast of Ercis",4.9,19.4,VII,Several buildings cracked in Van.,-,-,Turkey,18
1469,2021,12,6,"China, Qinghai, 297 km southwest of Xining",4.8,10,VI,At least 415 houses were damaged in Gadê County.,-,-,China,297
1470,2021,12,9,"Japan, Kagoshima offshore, 119 km north northeast of Naze",6.0,7,V,-,-,-,Japan,119
1471,2021,12,9,"Poland, Lower Silesia, 6 km east southeast of Polkowice",4.0,5,IV,Five miners were injured in the Lubin mine.,-,5,Poland,6
1472,2021,12,11,"Chile, Coquimbo, 39 km north of La Serena",5.7,53.3,V,"Some rockfalls were reported in the region, causing some road damage.",-,-,Chile,39
1473,2021,12,11,"Indonesia, Barat Daya Islandsoffshore, 248 km northeast of Lospalos, Timor Leste",5.4,13,VI,Foreshock of the 7.3 earthquake on December 29. Sixteen buildings were damaged and thirteen were destroyed in Damar Island.,-,-,Indonesia,248
1474,2021,12,12,"Australia offshore, west of Macquarie Island",6.6,10,-,-,-,-,Australia offshore,
1475,2021,12,14,"Indonesia offshore, Flores Sea, 112 km north of Maumere",7.3,18.4,VI,Further information: 2021 Flores earthquake,1,173,Indonesia offshore,112
1476,2021,12,15,"Indonesia, East Java offshore, 36 km southeast of Kencong",4.8,10,VI,"Six people injured, one home collapsed, and 45 others damaged in Jember Regency.",-,6,Indonesia,36
1477,2021,12,16,"Indonesia, Barat Daya Islandsoffshore, 247 km northeast of Lospalos, Timor Leste",5.6,10,VI,Seven houses and a church were damaged in Damar Island.,-,-,Indonesia,247
1478,2021,12,16,"South Georgia and the South Sandwich Islands offshore, South Sandwich Islands region",6.0,15,III,Aftershock of the 8.1 earthquake on August 12.,-,-,South Georgia and the South Sandwich Islands offshore,
1479,2021,12,18,"South Africa offshore, Prince Edward Islands region",6.0,10,-,-,-,-,South Africa offshore,
1480,2021,12,19,"Fiji, Bua offshore, 88 km west of Labasa",6.2,10,VI,-,-,-,Fiji,88
1481,2021,12,19,"Laos, Sainyabuli province, 53 km northwest of Sainyabuli",5.5,10,VII,"In Thailand, the main Buddha image of the Phumin Temple in Mueang Nan District, was damaged.Many houses in the area were also affected.",-,-,Laos,53
1482,2021,12,20,"Argentina, Salta, 40 km north of Burruyacú",5.0,10,IV,"Several buildings were damaged in Rosario de la Frontera, including a school and a nursing home.",-,-,Argentina,40
1483,2021,12,20,"United States, California offshore, 7 km north of Petrolia",6.2,27,VII,"Some minor damage was reported, such as cracks in roads and broken glass. The earthquake also triggered a number of small landslides, and brought down a factory roof.",-,-,United States,7
1484,2021,12,21,"Haiti, Grand'Anse, 9 km west southwest of Corail",4.4,12.5,V,Aftershock of the 2021 Haiti earthquake. Additional damage and 150 people were injured.,-,150,Haiti,9
1485,2021,12,22,"Mexico, Jalisco, offshore, 217 km southwest of La Cruz de Loreto",6.0,10,IV,-,-,-,Mexico,"offshore, 217"
1486,2021,12,23,"Morocco, Tanger-Tetouan-Al Hoceima, 4 km west northwest of Imzouren",4.8,10,VI,"Extensive damage was reported in Al Hoceïma, such as collapsed walls.",-,-,Morocco,4
1487,2021,12,23,"India, Andhra Pradesh",3.5,10,-,Around forty houses suffered cracks in Tamil Nadu.,-,-,India,
1488,2021,12,24,"Laos, Phongsaly Province, 88 km north northwest of Phongsali",5.7,9.5,VII,"Some twenty houses were damaged in Laos. In Yunnan, China, the wall of a school collapsed and the ceiling of an office building fell.Ten people were injured.",-,10,Laos,88
1489,2021,12,26,"Fiji, Lau offshore, 140 km east of Levuka",6.1,626.5,II,-,-,-,Fiji,140
1490,2021,12,27,"Pakistan, Gilgit-Baltistan, 60 km southeast of Gilgit",5.2,10,V,Nine people were injured and at least 450 homes were destroyed at the Roundu District of Skardu. Water and power services were also disrupted.,-,9,Pakistan,60
1491,2021,12,28,"Algeria, Skikda, 15 km south southwest of Skikda",4.3,11.6,III,Various buildings suffered material damage in Skikda.,-,-,Algeria,15
1492,2021,12,29,"Indonesia, Maluku offshore, 125 km north northeast of Lospalos, Timor Leste",7.3,165.5,VII,"Twelve homes were damaged and two collapsed in the Maluku Barat Daya Regency. Seven homes and irrigations damaged, and landslides occurred in Venilale, East Timor. Six houses damaged in Darwin, Australia.",-,-,Indonesia,125
1493,2020,1,2,"Iran, Khorasan-e Razavi, 81 km southwest of Taybad",5.5,10,VII,"At least 100 houses were damaged, some of them seriously.",,,Iran,81
1494,2020,1,5,"Mexico, Oaxaca, 3 km west of Reforma de Pineda",5.9,87,V,Some homes suffered minor damage.,-,-,Mexico,3
1495,2020,1,6,"Puerto Rico, Guayanilla offshore, 14 km south of Indios",5.8,6,VI,Further information: 201920 Puerto Rico earthquakes,-,-,Puerto Rico,14
1496,2020,1,7,"Indonesia, Aceh offshore, 14 km south of Sinabang",6.3,17,VI,Cracks in walls or broken windows were observed in some buildings in Sinabang.,-,-,Indonesia,14
1497,2020,1,7,"Puerto Rico, Guayanilla offshore, 13 km south of María Antonia",6.4,9,VIII,Further information: 201920 Puerto Rico earthquakes,3,8,Puerto Rico,13
1498,2020,1,7,"Papua New Guinea, East New Britain, 130 km east northeast of Kimbe",6.0,117,IV,,,,Papua New Guinea,130
1499,2020,1,8,"Iran, Bushehr, 13 km southeast of Borajzan",4.9,10,VI,"Some damage was caused and seven people were injured. This earthquake struck near the Bushehr nuclear plant, but did not damage it.",,7,Iran,13
1500,2020,1,9,"Russia, Chukotka Autonomous Okrug, 341 km northeast of Tilichiki",6.4,10,VII,,,,Russia,341
1501,2020,1,10,"Puerto Rico, Guánica offshore, 4 km south of María Antonia",5.2,9,VI,Further information: 201920 Puerto Rico earthquakes,1,,Puerto Rico,4
1502,2020,1,11,"Puerto Rico, , Guayanilla offshore, 5 km southeast of María Antonia",5.9,5,VII,Further information: 201920 Puerto Rico earthquakes,,,Puerto Rico,"Guayanilla offshore, 5"
1503,2020,1,12,"Philippines, Calabarzon, 3 km south southwest of Talisay",4.7,10,,It was the first of the three largest earthquakes in a swarm related to the eruption of the Taal Volcano.Several houses were damaged in Lemery.,,,Philippines,3
1504,2020,1,15,"Argentina, Mendoza, 17 km north northwest of San Martín",4.5,40,III,Light damage was observed in the city of Mendoza. One person fainted from fear during a live TV show.,,1,Argentina,17
1505,2020,1,17,"Mexico, Oaxaca, 6 km northeast of Ixtepec",5.2,17.5,VI,Various adobe houses and a church were damaged. The earthquake also caused some landslides and falling rocks blocked roads.,,,Mexico,6
1506,2020,1,18,"Indonesia, Papua, 146 km west of Abepura",6.0,44,VI,-,-,-,Indonesia,146
1507,2020,1,19,"China, Xinjiang, 104 km east northeast of Kashgar",6.0,5.6,VIII,Further information: 2020 Kashgar earthquake,1,2,China,104
1508,2020,1,19,"Indonesia, North Sulawesi offshore, 108 km southeast of Gorontalo",6.1,121.7,IV,,,,Indonesia,108
1509,2020,1,19,"United States, Kansas, 2 km west of South Hutchinson",4.5,5,VI,There were reports of bricks breaking off chimneys and sidewalks cracking in the Hutchinson area.,,,United States,2
1510,2020,1,20,"South Georgia and the South Sandwich Islands offshore, 25 km south southeast of Bristol Island",6.1,93,V,,,,South Georgia and the South Sandwich Islands offshore,
1511,2020,1,22,"Turkey, Manisa, 15 km east southeast of K?rka?aç",5.6,5.6,VII,"A few structures collapsed, with people running outside for safety. Four people were injured. The earthquake was felt in Istanbul and ?zmir.",,4,Turkey,15
1512,2020,1,23,"United States, Alaska offshore, Aleutian Islands, 84 km west of Adak",6.2,10,VI,,,,United States,"Aleutian Islands, 84"
1513,2020,1,24,"Turkey, Elaz??, 13 km north of Do?anyol",6.7,10,IX,Further information: 2020 Elaz?? earthquake,41,"1,631",Turkey,13
1514,2020,1,26,"United States, Alaska offshore, Aleutian Islands, 240 km west southwest of Adak",6.1,17,V,It was an aftershock of the 6.2 quake two days prior.,,,United States,"Aleutian Islands, 240"
1515,2020,1,27,"Solomon Islands, Makira-Ulawa offshore, 102 km west northwest of Kirakira",6.3,21,VI,,,,Solomon Islands,102
1516,2020,1,28,"Cayman Islands offshore, 123 km north northwest of Lucea, Jamaica",7.7,14.9,VI,Further information: 2020 Caribbean earthquake,,,Cayman Islands offshore,Jamaica
1517,2020,1,28,"Cayman Islands, Grand Caymanoffshore, 55 km southeast of East End",6.1,10,V,It was an aftershock of the 7.7 earthquake a few hours earlier.,,,Cayman Islands,55
1518,2020,1,29,"Solomon Islands, Makira-Ulawa offshore, 70 km west of Kirakira",6.0,85,V,It was an aftershock of the 6.3 quake two days prior.,,,Solomon Islands,70
1519,2020,2,5,"Indonesia, East Java offshore, 113 km north northeast of Bangkalan",6.2,592.4,I,,,,Indonesia,113
1520,2020,2,6,"Indonesia, North Sulawesi offshore, 13 km south of Miangas",6.0,19,IV,,,,Indonesia,13
1521,2020,2,8,"India, Uttarakhand, 29 km northeast of Bageshwar",4.7,18.8,IV,"Some houses were damaged, and one collapsed in Bageshwar district. Two people were injured by the rubble.",,2,India,29
1522,2020,2,8,"South Georgia and the South Sandwich Islands offshore, 113 km south southeast of Bristol Island",6.0,16,III,,,,South Georgia and the South Sandwich Islands offshore,
1523,2020,2,9,"Papua New Guinea, East New Britainoffshore, 127 km south of Kokopo",6.1,34,VI,,,,Papua New Guinea,127
