,year,month,date,country and location,mag,depth,mmi_level,impact,dead,injured,country,km
929,2023,12,7,"Indonesia, West Java offshore, 2 km (1.2 mi) west of Pelabuhanratu",3.9,9.5,VI,"Fourteen homes collapsed, 256 others and six buildings damaged, and ground cracks appeared in Sukabumi and Bogor regencies.",-,-,Indonesia,2
930,2023,12,7,"Mexico, Puebla, 8 km (5.0 mi) south southeast of Buenavista de Benito Juárez",5.7,51.2,V,One person injured in Taxco. Two buildings destroyed and many others damaged in Puebla.,-,1,Mexico,8
931,2023,12,11,"Tonga, Vava'u offshore, 158 km (98 mi)west of Neiafu",6.1,238.4,IV,-,-,-,Tonga,158
932,2023,12,13,"Indonesia, West Java, 14 km (8.7 mi)north northwest of Pelabuhanratu",4.5,10.4,V,"Two people injured, 48 homes collapsed, 1,076 others and nine buildings damaged in the Bogor-Sukabumi area.",-,2,Indonesia,14
933,2023,12,15,"Indonesia, Central Java, 20 km (12 mi)north northeast of Majenang",4.2,9.2,V,One home collapsed and 23 others damaged in Brebes Regency.,-,-,Indonesia,20
934,2023,12,16,"Indonesia, West Sumatra offshore, 144 km (89 mi) west northwest of Pariaman",5.0,52.4,IV,One home destroyed by a landslide in Lima Puluh Kota Regency.,-,-,Indonesia,144
935,2023,12,18,"China, Gansu, 37 km (23 mi) west northwest of Linxia Chengguanzhen",5.9,10,IX,Further information: 2023 Jishishan earthquake,151,982,China,37
936,2023,12,20,"Peru, Arequipa, 11 km (6.8 mi) south southeast of Iray",6.2,93.4,V,"Some homes collapsed, 30 others damaged, and landslides blocked roads in the Aplao area.",-,-,Peru,11
937,2023,12,21,"United States, Alaska offshore, 107 km (66 mi) southeast of Adak",6.1,30.1,IV,-,-,-,United States,107
938,2023,12,22,south of Africa,6.1,10,-,-,-,-,south of Africa,
939,2023,12,27,"Indonesia, West Java offshore, 52 km (32 mi) south southwest of Singaparna",5.1,71.6,III,Two buildings collapsed and one home damaged in Tasikmalaya. One home collapsed in Garut and another in Sukabumi.,-,-,Indonesia,52
940,2023,12,28,"Russia, Kuril Islands offshore, 113 km (70 mi) southeast of Kuril'sk",6.5,23.8,V,-,-,-,Russia,113
941,2023,12,30,"Indonesia, Papua, 147 km (91 mi) west southwest of Abepura",6.3,39.1,VI,-,-,-,Indonesia,147
942,2023,12,30,"Bosnia and Herzegovina, Zenica-Doboj, 9 km (5.6 mi) south southwest of eljezno Polje",4.7,10.5,VI,"Five people injured, one home collapsed and many others severely damaged, landslides and power outages occurred in the Zenica-Ljubetovo area.",-,5,Bosnia and Herzegovina,9
943,2023,12,31,"Indonesia, West Java, 16 km (9.9 mi)northwest of Sumedang Utara",4.8,11.4,V,"Eleven people injured, 81 homes collapsed and 1,441 structures damaged in the Sumedang area.",-,11,Indonesia,16
944,2022,1,2,"China, Yunnan, 99 km (62 mi) east of Shangri-La",5.4,10,VI,"Thirty people were injured, two of whom are in critical condition, and 7,904 homes were damaged and 1,500 destroyed in Ninglang County.",,30,China,99
945,2022,1,3,"Vanuatu, Torba offshore, 110 km (68 mi)northwest of Sola",6.0,104,IV,,,,Vanuatu,110
946,2022,1,3,"Taiwan, Hualien offshore, 66 km (41 mi)east of Hualien City",6.2,19,IV,"Fifteen buildings sustained minor damage in Taipei, such as cracks on walls and tiles falling off walls and ceilings.Power and water services were both disrupted. A car was damaged in Yilan after being hit by a rockfall.",,,Taiwan,66
947,2022,1,4,"Indonesia offshore, Banda Sea, 284 km (176 mi) east of Katabu",6.0,544,II,,,,Indonesia offshore,284
948,2022,1,6,"Nicaragua, León offshore, 61 km (38 mi)south of Corinto",6.1,17,V,,,,Nicaragua,61
949,2022,1,7,"Peru, Lima, 6 km (3.7 mi) northwest of Cocachacra",5.6,95.8,V,"Some damage was caused in Lima, where twelve buildings were destroyed and rockslides occurred. 39 people were injured, one of them seriously, after jumping and falling from a balcony.",,39,Peru,6
950,2022,1,7,"China, Qinghai, 109 km (68 mi)southwest of Jinchang",6.6,13,IX,Further information: 2022 Menyuan earthquake,,9,China,109
951,2022,1,9,"Greece, Western Macedonia, 5 km (3.1 mi) north northwest of Florina",5.5,13.5,VII,"In Florina, the facades of buildings fell, cracks on masonry houses appeared, an old uninhabited house in the village of Agia Paraskevicollapsed, and glass windows were shattered. Cracks were reported in a hundred buildings in Bitola, North Macedonia. Two people were injured.Seventeen buildings were also damaged in eastern Albania.",,2,Greece,5
952,2022,1,9,"Indonesia, North Maluku, 33 km (21 mi)south southwest of Tobelo",5.4,10,VII,Three people were injured.,,3,Indonesia,33
953,2022,1,10,"New Zealand, Kermadec Islandsoffshore, 526 km (327 mi) northeast of Whang?rei",6.2,7,V,,,,New Zealand,526
954,2022,1,10,"Iraq, Sulaymaniyah, 8 km (5.0 mi) east of Jamjam?l",4.5,10,VI,Several buildings were damaged in Chamchamal District.,,,Iraq,8
955,2022,1,11,"Cyprus, Paphos offshore, 48 km (30 mi)west northwest of Polis",6.6,21,VI,Further information: 2022 Cyprus earthquake,3,1,Cyprus,48
956,2022,1,11,"United States, Alaska, Fox Islandsoffshore, 100 km (62 mi) southeast of Nikolski",6.8,20,VI,"Spaced an hour apart, these two earthquakes formed a mainshock-aftershock sequence. The first earthquake triggered a tsunami which was observed with heights of 23 cm (0.75 ft).",,,United States,"Fox Islandsoffshore, 100"
957,2022,1,11,"United States, Alaska, Fox Islandsoffshore, 53 km (33 mi) southeast of Nikolski",6.6,19,V,,,,United States,"Fox Islandsoffshore, 53"
958,2022,1,14,"Indonesia, Banten offshore, 80 km (50 mi) southwest of Labuan",6.6,33,VI,"At least 226 buildings were destroyed, and at least 3,078 buildings, including 51 schools, 21 mosques, and eight offices were damaged in Pandeglang Regency. A mosque, a hospital, and a wall in East Jakarta mayor's office were cracked. A number of buildings in the Ujung Kulon National Parkwere damaged or destroyed. In Banten, ten people were injured by falling debris, two of whom are in critical condition.",,10,Indonesia,80
959,2022,1,14,"Albania, Shkodër, 4 km (2.5 mi)southeast of Fushë-Arrëz",4.3,10,VI,"39 buildings were damaged in Pukë, including a school, a hospital and a museum. The damage is estimated at 5 million euros.",,,Albania,4
960,2022,1,15,"Iran, Kerman, 31 km (19 mi) northeast of Kerman",4.7,10,VIII,"At least five buildings were damaged in Kerman, and two people were injured.",,2,Iran,31
961,2022,1,16,"Papua New Guinea, Bougainvilleoffshore, 75 km (47 mi) west southwest of Panguna",6.1,379,III,,,,Papua New Guinea,75
962,2022,1,17,"Afghanistan, Badhgis, 45 km (28 mi) east of Qala i Naw",4.9,10,,Further information: January 2022 Afghanistan earthquakes,30,49,Afghanistan,45
963,2022,1,17,"Afghanistan, Badghis, 45 km (28 mi) east of Qala i Naw",5.3,11.4,VI,,,,Afghanistan,45
964,2022,1,17,"Turkey, Kayseri, 3 km (1.9 mi) northwest of Sar?o?lan",4.9,10,VII,Cracks appeared in walls of several houses and some livestock were killed by collapsing sheds. Two people were injured after fleeing in panic.,,2,Turkey,3
965,2022,1,21,"Japan, ?ita offshore, 27 km (17 mi) south southeast of Saiki",6.4,40,VII,"Power outages occurred in Saiki and water pipes were damaged, flooding roads. At least 13 people were injured, two of them seriously.",,13,Japan,27
966,2022,1,22,"Indonesia, North Sulawesi offshore, 234 km (145 mi) southeast of Sarangani, Philippines",6.0,21,VI,At least two houses and a church were damaged in Talaud Islands Regency. A construction worker suffered serious injuries after jumping off a building due to panic.,,1,Indonesia,234
967,2022,1,22,"United States, Alaska, Fox Islandsoffshore, 70 km (43 mi) south of Unalaska",6.2,29,VI,,,,United States,"Fox Islandsoffshore, 70"
968,2022,1,23,"Iran, East Azerbaijan, 7 km (4.3 mi) west northwest of Tabriz",4.0,10,VII,"In Tabriz, cracks appeared in the walls of at least five buildings. One person was injured after a fall.",,1,Iran,7
969,2022,1,24,"Haiti, Nippes, 4 km (2.5 mi) south of Anse-à-Veau",5.3,10,VI,"Two people were killed; one in Fonds-des-Nègres by a landslide, the other in Anse-à-Veau by a collapsing wall. Fifty-two people were injured. At least 227 houses were destroyed and 937 were damaged in Nippes. The pair of earthquakes are aftershocks of the 2021 Haiti earthquake.",2,52,Haiti,4
970,2022,1,24,"Haiti, Nippes offshore, 4 km (2.5 mi) east of Anse-à-Veau",5.1,10,VI,,,,Haiti,4
971,2022,1,24,"Australia, Western Australia, 23 km (14 mi) west of Wagin",4.9,7.4,V,"Part of an earthquake swarm. Around twenty buildings had minor damage, such as cracks in walls and ceilings.",,,Australia,23
972,2022,1,25,"South Georgia and the South Sandwich Islands offshore, South Sandwich Islandsregion",6.0,11,III,,,,South Georgia and the South Sandwich Islands offshore,
973,2022,1,27,"Tonga, Ha'apai offshore, 220 km (140 mi)west northwest of Pangai",6.2,6.2,IV,,,,Tonga,220
974,2022,1,28,"Panama, Chiriquí offshore, 281 km (175 mi) southwest of Arenas",6.0,8,III,,,,Panama,281
975,2022,1,29,"New Zealand, Kermadec Islandsoffshore, 1,081 km (672 mi) northeast of Whang?rei",6.5,8,IV,"A small tsunami was reported at Boat Cove station on Raoul Island, with heights of around 10 cm (0.33 ft).",,,New Zealand,"1,081"
976,2022,2,1,"Indonesia, Maluku offshore, 184 km (114 mi) northeast of Lospalos, Timor Leste",6.0,119,IV,,,,Indonesia,184
977,2022,2,3,"Peru, Loreto, 49 km (30 mi) northwest of Barranca",6.5,110,VI,"Eighty houses and seven public buildings were damaged in the Barranca District, while two buildings suffered minor damage in Zamora-Chinchipe Province, Ecuador.",,,Peru,49
978,2022,2,4,"Indonesia, Banten offshore, 71 km (44 mi) west southwest of Pelabuhanratu",5.2,45.9,VI,A school in Lebak Regencywas damaged by landslides.,,,Indonesia,71
979,2022,2,4,Southeast Indian Ridge,6.3,10,,,,,Southeast Indian Ridge,
980,2022,2,5,"Afghanistan, Badakhshan, 46 km (29 mi)southwest of Ashk?sham",5.8,212,IV,"Two miners were killed by a landslide in Badakhshan Province. Five houses were destroyed and fifty were damaged in Peshawar, Pakistan, where one person was killed and the minaret of a famous Sufishrine was tilted.",3,,Afghanistan,46
981,2022,2,7,"Poland, Silesia, 4 km (2.5 mi) east southeast of Katowice",4.2,10,VII,Three miners were injured by falling rocks.,,3,Poland,4
982,2022,2,8,Central Mid-Atlantic Ridge,6.2,10,,,,,Central Mid-Atlantic Ridge,
983,2022,2,13,"Armenia, Lori, 19 km (12 mi) west southwest of Metsavan",5.3,10,VI,"Fifty buildings were damaged in Armenia, where power outages occurred. In Georgia, cracks appeared in the walls of 21 buildings. In Turkey, two people suffered injuries, and minor damage was caused. It was the largest earthquake in Armenia since 1988.",,2,Armenia,19
984,2022,2,13,"Guam offshore, 168 km (104 mi)southwest of Merizo Village",6.0,15,III,,,,Guam offshore,
985,2022,2,16,"Guatemala, Escuintla, 7 km (4.3 mi)southwest of Nueva Concepción",6.2,60,VI,Further information: 2022 Guatemala earthquake,3,2,Guatemala,7
986,2022,2,16,South of the Fiji Islands,6.8,535,III,,,,South of the Fiji Islands,
987,2022,2,21,"Antarctica offshore, Balleny Islandsregion",6.3,14,IV,,,,Antarctica offshore,
988,2022,2,22,"Argentina, Jujuy, 58 km (36 mi) west of Abra Pampa",6.0,251,IV,,,,Argentina,58
989,2022,2,23,"Colombia, Bolívar, 26 km (16 mi)southwest of Santa Rosa del Sur",5.5,50.7,V,A school was damaged in Santa Rosa del Sur.,,,Colombia,26
990,2022,2,25,"Indonesia, West Sumatra, 66 km (41 mi)north northwest of Bukittinggi",6.1,4.9,VIII,Further information: 2022 Sumatra earthquake,27,457,Indonesia,66
991,2022,3,2,"New Zealand, Kermadec Islandsoffshore, 951 km (591 mi) northeast of Ngunguru",6.6,24,VII,,,,New Zealand,951
992,2022,3,3,"Mexico, Veracruz, 15 km (9.3 mi) west northwest of Nopalapan",5.7,109.4,IV,A school in Veracruz was damaged.,,,Mexico,15
993,2022,3,5,"Laos, Phôngsali, 85 km (53 mi) north northwest of Phôngsali",4.5,10,VII,"Five houses were damaged in Yunnan, in neighboring China.",,,Laos,85
994,2022,3,6,"South Georgia and the South Sandwich Islands offshore, South Sandwich Islandsregion",6.0,15.5,IV,,,,South Georgia and the South Sandwich Islands offshore,
995,2022,3,7,"Fiji, Lomaiviti offshore, 351 km (218 mi)southeast of Levuka",6.1,581.8,II,,,,Fiji,351
996,2022,3,12,"Indonesia, West Java offshore, 63 km (39 mi) southwest of Pelabuhanratu",5.3,10,V,"Houses in Sukabumi were damaged, one of which was completely destroyed.",,,Indonesia,63
997,2022,3,12,"France, Auvergne-Rhône-Alpes, 3 km (1.9 mi) south of Faverges",4.5,2.7,VI,"Buildings and chimneys were damaged. In Frontenex, the cross of a church fell.",,,France,3
998,2022,3,13,"Philippines, Mimaropa offshore, 67 km (42 mi) northwest of Cabra",6.4,11,IV,At least three houses in Lubang sustained damage.,,,Philippines,67
999,2022,3,13,"Indonesia, West Sumatra offshore, 168 km (104 mi) west of Pariaman",6.7,21.8,VII,"Some damage was caused in South Nias Regency, and one person was slightly injured. Tsunami waves up to 8 cm (0.26 ft) were also reported.",,1,Indonesia,168
1000,2022,3,15,"Peru, Arequipa, 16 km (9.9 mi) east southeast of Huambo",4.7,10,VI,Foreshock of the 5.5 earthquake a day later. Several houses were damaged in Maca and landslides occurred in Caylloma.,,,Peru,16
1001,2022,3,16,"Indonesia, West Java offshore, 80 km (50 mi) southwest of Banjar",5.3,37,VI,At least seven buildings were damaged in Cianjur Regency.,,,Indonesia,80
1002,2022,3,16,"Peru, Arequipa, 12 km (7.5 mi) south of Tapay",5.5,10.7,VII,Landslides occurred in Caylloma. Six people were injured.,,6,Peru,12
1003,2022,3,16,"Pakistan, Gilgit-Baltistan, 67 km (42 mi)southeast of Gilgit",5.1,9.1,VII,"Major damage and landslides occurred in the region, blocking roads.One person was killed and nine were injured by falling rocks in the village of Astak.",1,9,Pakistan,67
1004,2022,3,16,"Japan, Fukushima offshore, 62 km (39 mi) east northeast of Namie",6.0,48.1,IV,Foreshock of the 7.3 quake a few minutes later.,,,Japan,62
1005,2022,3,16,"Japan, Fukushima offshore, 57 km (35 mi) east northeast of Namie",7.3,41,VIII,Further information: 2022 Fukushima earthquake,4,247,Japan,57
1006,2022,3,16,"Iran, Hormozgan, 59 km (37 mi) north northwest of Bandar Lengeh",5.9,22,VII,A few buildings were damaged and electricity was disrupted in Faramarzan and Kukherd. Landslides also occurred in the region. Two people were injured. The earthquake could be also felt in the United Arab Emirates.,,2,Iran,59
1007,2022,3,19,"Algeria, Béjaïa offshore, 15 km (9.3 mi)northeast of Béjaïa",5.2,10,VIII,"Over 1,700 buildings, including a school and a hospital, were damaged in Béjaïa. The interior ceiling of a room also fell in. Thirty people were injured, including three students who fell in panic.",,30,Algeria,15
1008,2022,3,19,"Iran, Fars, 91 km (57 mi) southeast of Darab",4.7,10,VII,Cracks appeared in the walls of 10 homes. Two people were injured.,,2,Iran,91
1009,2022,3,19,"Tonga, Eua offshore, 462 km (287 mi)southeast of Ohonua",6.3,21,I,,,,Tonga,462
1010,2022,3,20,"Philippines, Eastern Visayas, 5 km (3.1 mi) southwest of Burauen",5.3,10,VII,39 houses were damaged and one was destroyed in Burauen.,,,Philippines,5
1011,2022,3,20,"New Zealand, Kermadec Islandsoffshore, 1,107 km (688 mi) northeast of Whang?rei",6.0,47.6,IV,,,,New Zealand,"1,107"
1012,2022,3,21,"Philippines, Zamboanga Peninsulaoffshore, 10 km (6.2 mi) south of Limaong",3.8,10,V,One school suffered damage on Vitali Island.,,,Philippines,10
1013,2022,3,21,"Norway, Vestland offshore, 138 km (86 mi) west of Florø",5.2,10,VI,It is the largest earthquake to hit Norway since 1989. The municipal hall in Modalen Municipality was slightly damaged.,,,Norway,138
1014,2022,3,22,Northern Mid-Atlantic Ridge,6.7,10,,,,,Northern Mid-Atlantic Ridge,
1015,2022,3,22,"Taiwan, Taitung offshore, 62 km (39 mi)south of Hualien City",6.7,24,VII,"One person was injured by broken glass. A bridge collapsed in Yuli, 230 buildings were damaged and one was destroyed, and power outages occurred. A road cracked in Taitung, and rockfalls blocked roads in Changbin and Donghe.",,1,Taiwan,62
1016,2022,3,23,"Haiti, Grand'Anse offshore, 18 km (11 mi)north of Jérémie",5.1,10,VIII,Some houses and a church were damaged in Jérémie. Five people suffered minor injuries.,,5,Haiti,18
1017,2022,3,23,"Vanuatu, Sanma offshore, 36 km (22 mi)southeast of Port-Olry",6.0,115.7,IV,,,,Vanuatu,36
1018,2022,3,24,"Indonesia, Maluku, 44 km (27 mi) west of Amahai",4.7,53.8,VII,At least 42 buildings were damaged in Ambon.,,,Indonesia,44
1019,2022,3,25,"Indonesia, Southeast Sulawesi offshore, 39 km (24 mi) east northeast of Kendari",4.7,10,V,"In Kendari, dozens of homes and a religious monument were damaged. Items were knocked off shelves in shops and supermarkets.",,,Indonesia,39
1020,2022,3,27,"Ecuador, Esmeraldas, 7 km (4.3 mi)southeast of Esmeraldas",5.8,19,VII,"Power outages and telecommunication disruptions were reported in Esmeraldas. One person died of a cardiac arrest and another was injured. 717 homes collapsed and 7,408 were damaged. Two hospitals were also damaged.",1,1,Ecuador,7
1021,2022,3,29,"Peru, Apurímac, 7 km (4.3 mi) south of Abancay",4.4,68.4,V,Three homes were destroyed and 32 were damaged in Abancay. 78 people were displaced.,,,Peru,7
1022,2022,3,29,"Poland, Lower Silesian Voivodeship",3.0,10,,"A mine collapse occurred in Katowice, injuring one person.",,1,Poland,
1023,2022,3,30,"New Caledonia, Loyalty Islandsoffshore, 279 km (173 mi) southeast of Tadine",6.9,10,IV,"Foreshock of the 7.0 event eight hours later. Small tsunamis were observed, with heights of 6 cm (0.20 ft)in the Ouinne River, 7 cm (0.23 ft) in Tadine, and 2 cm (0.066 ft) in Lifou.",,,New Caledonia,279
1024,2022,3,31,"Iran, Khuzestan, 19 km (12 mi) southeast of Aghajari",4.7,10,IV,One person was injured.,,1,Iran,19
1025,2022,3,31,"New Caledonia, Loyalty Islandsoffshore, 279 km (173 mi) east southeast of Tadine",7.0,10,IV,A tsunami with heights of 5 cm (0.16 ft) was detected in Tadine.,,,New Caledonia,279
1026,2022,3,31,"New Caledonia, Loyalty Islandsoffshore, 326 km (203 mi) southeast of Tadine",6.4,20,V,Aftershock of the 7.0 earthquake 14 hours earlier.,,,New Caledonia,326
1027,2022,4,1,"Netherlands, Groningen, 10 km (6.2 mi)west of Delfzijl",2.7,3,,At least 250 buildings were damaged in Loppersum. This earthquake was caused by gas extraction.,,,Netherlands,10
1028,2022,4,4,"Bulgaria, Varna, 10 km (6.2 mi) southeast of Provadia",4.6,10,VII,The town hall of Provadia and a church were damaged.,,,Bulgaria,10
1029,2022,4,4,"Vanuatu, Shefa offshore, 56 km (35 mi)west northwest of Port Vila",6.0,31,V,,,,Vanuatu,56
1030,2022,4,5,"China, Sichuan, 4 km (2.5 mi) southeast of Xunchang",4.6,10,VII,"In Xingwen County, several roads cracked and a highway collapsed, 1,660 homes were damaged, power outages occurred and rockslides were reported. Train services were disrupted.",,,China,4
1031,2022,4,8,"Iraq, Wasit, 26 km (16 mi) west of Mehran, Iran",3.6,10,III,One person was injured while fleeing in panic in Mehran.,,1,Iraq,26
1032,2022,4,9,"Turkey, Malatya, 7 km (4.3 mi) north northeast of Sincik",5.3,10,VIII,A few old houses were destroyed and several unoccupied buildings were damaged in Pütürge.,,,Turkey,7
1033,2022,4,9,"Vanuatu, Malampa offshore, 63 km (39 mi) west southwest of Norsup",6.3,17,V,The earthquake triggered a tsunami with heights of 21 cm (0.69 ft).,,,Vanuatu,63
1034,2022,4,10,"Peru, Arequipa, 19 km (12 mi) southeast of Toro",3.9,10,III,"Around forty houses were destroyed in Madrigal, and 200 people were evacuated.",,,Peru,19
1035,2022,4,13,"Papua New Guinea, East New Britain, 28 km (17 mi) west southwest of Kokopo",6.1,149,IV,,,,Papua New Guinea,28
1036,2022,4,17,"Vanuatu, Malampa offshore, 62 km (39 mi) northeast of Norsup",6.1,200.9,IV,,,,Vanuatu,62
1037,2022,4,18,"Indonesia, North Maluku, 31 km (19 mi)west northwest of Tobelo",5.0,19.3,VI,"At least 69 buildings were destroyed and 226 were damaged in five villages, including a church. Two people were injured.",,2,Indonesia,31
1038,2022,4,18,"Vietnam, Kon Tum, 45 km (28 mi) north northeast of Kon Tum",4.8,10,IV,Schools were damaged in Kon Plông district.,,,Vietnam,45
1039,2022,4,19,"Philippines, Davao offshore, 41 km (25 mi) east of Santiago",6.1,19,V,"Spaced a day apart, these two earthquakes can be considered a doublet.",,,Philippines,41
1040,2022,4,20,"Philippines, Davao offshore, 50 km (31 mi) southeast of Manay",6.0,19,V,,,,Philippines,50
1041,2022,4,21,"Nicaragua, León offshore, 58 km (36 mi)west southwest of Masachapa",6.6,25.3,V,"Some buildings and a church, which was previously affected by the 1972 earthquake, were damaged and power outages occurred in Managua. A small tsunami with heights of 7 cm (0.23 ft) was also observed.",,,Nicaragua,58
1042,2022,4,22,"Bosnia and Herzegovina, Srpska, 13 km (8.1 mi) north northeast of Ljubinje",5.7,10,VIII,Further information: 2022 Bosnia and Herzegovina earthquake,1,14,Bosnia and Herzegovina,13
1043,2022,4,23,"Poland, Silesian Voivodeship, 4 km (2.5 mi) northeast of ?wierklany Górne",2.7,5,V,Ten people were killed in a mining accident in Zofiówkain coal mine.,10,,Poland,4
1044,2022,4,23,"Iran, Fars, 30 km (19 mi) east of Kazerun",4.4,10,VI,Ten homes were damaged in the region around the epicentre. One person was injured after jumping out from a window.,,1,Iran,30
1045,2022,4,24,"Bosnia and Herzegovina, Srpska, 12 km (7.5 mi) north northeast of Ljubinje",4.8,10,VI,"Aftershock of the 5.7 earthquake two days prior. Further damage was caused, with many buildings, including barracks built during the Austro-Hungarian Empire, being affected.",,,Bosnia and Herzegovina,12
1046,2022,4,27,"Poland, Lower Silesia, 6 km (3.7 mi) west southwest of Rudna",4.4,5,VI,One person was injured in a mine near Rudna.,,1,Poland,6
1047,2022,4,28,"Papua New Guinea, Madang offshore, 175 km (109 mi) north northeast of Madang",6.1,10,IV,,,,Papua New Guinea,175
1048,2022,5,5,"Philippines, Davao offshore, 94 km (58 mi) southeast of Lukatan",6.0,18,IV,,,,Philippines,94
1049,2022,5,6,"Pakistan, Balochistan, 80 km (50 mi)north of Bela",5.1,10,VI,At least 260 buildings were damaged and more than 80 houses were destroyed in the Khuzdar area. One child was injured and 200 families were displaced.,,1,Pakistan,80
1050,2022,5,9,"Taiwan, Hualien offshore, 70 km (43 mi)southwest of Yonakuni, Japan",6.2,21,IV,,,,Taiwan,70
1051,2022,5,9,"Papua New Guinea, Madang offshore, 177 km (110 mi) southwest of Lorengau",6.3,10,IV,,,,Papua New Guinea,177
1052,2022,5,10,"Argentina, Jujuy, 85 km (53 mi) north northwest of San Antonio de los Cobres",6.8,220,VI,,,,Argentina,85
1053,2022,5,12,"Colombia, Valle del Cauca, 10 km (6.2 mi) north of Darien",5.0,88.8,VI,"Several houses, two supermarkets, and a terminal were damaged in three towns in Valle del Cauca.",,,Colombia,10
1054,2022,5,12,"Peru, Lima offshore, 12 km (7.5 mi) west northwest of San Bartolo",5.4,51.2,VII,"Two people were indirectly killed, 11 others were injured, four houses collapsed and 17 others were damaged in the Lima-Huaral area.",2,11,Peru,12
1055,2022,5,17,"Iran, Khuzestan, 70 km (43 mi) east northeast of Ramhormoz",4.9,10,VI,Many homes damaged.,,,Iran,70
1056,2022,5,19,"Australia, Tasmania offshore, 40 km (25 mi) north of Macquarie Island",6.9,10,V,,,,Australia,40
1057,2022,5,20,"China, Sichuan, 74 km (46 mi) east of Kangding",4.9,10,IV,At least 468 houses were damaged in Hanyuan County. Roads were also blocked by rockfalls. This was an aftershock of the 2013 Lushan earthquakenine years prior.,,,China,74
1058,2022,5,21,"Philippines, Calabarzon, 1 km (0.62 mi)south of Lian",6.1,129,V,,,,Philippines,1
1059,2022,5,22,"Tonga, Tongatapu offshore, 855 km (531 mi) southwest of Vaini",6.3,589.5,II,,,,Tonga,855
1060,2022,5,22,"Japan, Chiba offshore, 237 km (147 mi)southeast of Katsuura",6.0,15.8,III,,,,Japan,237
1061,2022,5,24,"Afghanistan, Badakhshan, 62 km (39 mi)southeast of Farkh?r",4.9,106.2,VI,Several houses in the Jurm District suffered minor damage. Two people died and another was injured when their house collapsed.,2,1,Afghanistan,62
1062,2022,5,24,"Zimbabwe, Matabeleland North, 14 km (8.7 mi) southeast of Binga",4.7,10,VIII,"Severe damage occurred in some buildings, including a school.",,,Zimbabwe,14
1063,2022,5,25,"Mexico, Oaxaca, 12 km (7.5 mi) west northwest of Santa María Ecatepec",5.5,12,VI,One house was destroyed and a fire occurred at an oil refinery in Salina Cruz. A tsunami was also observed with heights of 47 cm (1.54 ft) in Puerto Chiapas.,,,Mexico,12
1064,2022,5,26,"Peru, Puno, 1 km (0.62 mi) north of Azángaro",7.2,252,VI,"Two buildings collapsed and 115 others, including seventeen schools, five hospitals, 87 houses, a church, four tourist sites and a bridge were damaged in the departments of Puno, Arequipa and Ayacucho. A highway was also blocked by a rockslide.",,,Peru,1
1065,2022,5,26,"New Caledonia, Loyalty Islandsoffshore, 460 km (290 mi) south southeast of Tadine",6.6,10,III,,,,New Caledonia,460
1066,2022,5,26,Southern East Pacific Rise,6.2,10,,,,,Southern East Pacific Rise,
1067,2022,5,27,"Timor Leste, Lautém offshore, 38 km (24 mi) northeast of Lospalos",6.2,49,VI,"In Maluku, Indonesia, a house and a school were damaged. The quake was felt as far away as Darwin, Australia.",,,Timor Leste,38
1068,2022,5,27,"Peru, Ica, 14 km (8.7 mi) southeast of Santiago",5.5,43,IV,"Eight people were injured while fleeing in panic, and several buildings, including a shopping mall, three schools and two health facilities in Icawere damaged.",,8,Peru,14
